{
  "$schema": "https://json-schema.org/draft/2020-12/schema",
  "$id": "https://github.com/pacocartones/free-llm-api-hub/blob/main/data/schema.json",
  "title": "free-llm-api-hub dataset",
  "description": "Schema for the canonical dataset of free-tier and trial-credit LLM API providers. README tables, the freshness badge, and the interactive site are all generated from this file.",
  "type": "object",
  "required": ["version", "generated", "providers"],
  "additionalProperties": false,
  "properties": {
    "$schema": { "type": "string" },
    "version": {
      "type": "string",
      "description": "Dataset release version (semver), in lockstep with the vX.Y.Z Git tag.",
      "pattern": "^[0-9]+\\.[0-9]+\\.[0-9]+$"
    },
    "generated": {
      "type": "string",
      "description": "Date the dataset was last built/serialised (YYYY-MM-DD).",
      "format": "date"
    },
    "source": { "type": "string", "format": "uri" },
    "note": { "type": "string" },
    "providers": {
      "type": "array",
      "minItems": 1,
      "items": { "$ref": "#/$defs/provider" }
    }
  },
  "$defs": {
    "tristate": {
      "description": "true / false / null, where null means 'not yet confirmed'.",
      "type": ["boolean", "null"]
    },
    "provider": {
      "type": "object",
      "additionalProperties": false,
      "required": [
        "slug", "name", "category", "free_type", "free_tier",
        "docs_url", "verified", "is_text_llm"
      ],
      "properties": {
        "slug": {
          "type": "string",
          "description": "Stable, unique, kebab-case identifier. Never reused or renamed.",
          "pattern": "^[a-z0-9]+(-[a-z0-9]+)*$"
        },
        "name": { "type": "string", "minLength": 1 },
        "category": {
          "description": "Primary bucket used to split the README and the site.",
          "type": "string",
          "enum": ["ongoing", "trial"]
        },
        "free_type": {
          "description": "Finer-grained shape of the free access.",
          "type": "string",
          "enum": ["perpetual", "renewing-quota", "recurring-credit", "trial-credit"]
        },
        "free_tier": {
          "type": "string",
          "description": "What you actually get for free, in concrete terms.",
          "minLength": 1
        },
        "rate_limits": { "type": "string" },
        "notes": {
          "type": "string",
          "description": "The catch: fine print a builder needs before relying on this."
        },
        "best_for": {
          "type": ["string", "null"],
          "description": "Editorial one-liner: when this is the right pick."
        },
        "modalities": {
          "type": "array",
          "description": "Modalities reachable on the free tier.",
          "items": {
            "type": "string",
            "enum": ["text", "vision", "image", "audio", "embeddings", "rerank", "ocr"]
          },
          "uniqueItems": true
        },
        "expires": {
          "type": ["string", "null"],
          "description": "Validity window for time-limited offers, e.g. '30 days'. null for perpetual/renewing tiers."
        },
        "docs_url": {
          "type": "string",
          "description": "Primary source: the provider's own pricing/rate-limit docs. Empty string only for flagged-unverified entries."
        },
        "phone_required": { "$ref": "#/$defs/tristate" },
        "card_required": { "$ref": "#/$defs/tristate" },
        "commercial_ok": { "$ref": "#/$defs/tristate" },
        "openai_compatible": { "$ref": "#/$defs/tristate" },
        "openai_base_url": {
          "type": ["string", "null"],
          "description": "OpenAI-compatible base URL for a drop-in SDK swap, when confirmed. null until backfilled."
        },
        "env_key": {
          "type": "string",
          "description": "Name of the environment variable holding this provider's API key, used by scripts/probe.mjs (and fetch-models) for live testing. Its presence marks a provider as probeable; the value itself lives only in the secrets store, never here."
        },
        "models_free": {
          "type": ["array", "null"],
          "description": "Sample of model IDs available on the free tier (attribute; sampled and may change — not part of the verified core claim).",
          "items": { "type": "string" },
          "uniqueItems": true
        },
        "is_text_llm": {
          "type": "boolean",
          "description": "True when the free offering (free tier or trial credit) gives API access to text/chat language models. False for OCR, text-to-speech, speech-to-text, embeddings-only, image and compute-only services. Explicit on every entry; it makes an entry eligible for the top 10."
        },
        "partner": {
          "type": "boolean",
          "description": "True when the provider has a commercial or sponsorship relationship with this project. It never changes a score or a rank. A partner can appear only on the /best podium (ranks 1 to 3), marked as a partner; one ranked 4 to 10 fails validation. Absent means not a partner."
        },
        "partner_note": {
          "type": "string",
          "minLength": 1,
          "description": "The public note about the relationship, shown next to the Partner label on the podium. Required when partner is true."
        },
        "model_tier": {
          "type": ["integer", "null"],
          "minimum": 0,
          "maximum": 4,
          "description": "Quality tier 0-4 of the best free model that has a public rating, derived from model_tier_source.rating with the thresholds in docs/methodology.md (4 >= 1450, 3 >= 1400, 2 >= 1330, 1 >= 1250, 0 below). Null when no source exists; never estimated. Trial-credit offers are not rated: a one-time credit is not continuous free access."
        },
        "model_tier_source": {
          "type": ["object", "null"],
          "additionalProperties": false,
          "required": ["model", "arena_model", "match", "rating", "ci", "votes", "snapshot", "url"],
          "description": "Where model_tier comes from: the provider's model, the exact row of the LMArena Arena Leaderboard Dataset (CC-BY-4.0) it maps to, and that row's rating and vote count at the snapshot date.",
          "properties": {
            "model": { "type": "string", "minLength": 1, "description": "The model id as the provider lists it (models_free)." },
            "arena_model": { "type": "string", "minLength": 1, "description": "The model_name of the matching Arena row." },
            "match": { "enum": ["exact", "variant"], "description": "exact = same id; variant = same model with a serving suffix (quantisation, :free, effort level)." },
            "rating": { "type": "number", "description": "Arena rating (text, style control, overall) at the snapshot." },
            "ci": { "type": "array", "minItems": 2, "maxItems": 2, "items": { "type": "number" }, "description": "The row's 95% confidence interval [lower, upper] at the snapshot." },
            "votes": { "type": "integer", "minimum": 1000, "description": "Vote count of that row; a row needs at least 1,000." },
            "boundary": { "type": "boolean", "description": "True when the interval crosses a tier threshold or lies within 5 rating points of one: the tier could change at the next snapshot. Derived from ci and checked by validate.mjs." },
            "snapshot": { "type": "string", "format": "date", "description": "The leaderboard_publish_date of the Arena snapshot." },
            "url": { "type": "string", "format": "uri", "description": "The dataset the row comes from." }
          }
        },
        "free_limits": {
          "type": ["object", "null"],
          "additionalProperties": false,
          "required": ["source", "checked"],
          "minProperties": 3,
          "description": "Numeric free limits exactly as the provider publishes them. Null when the provider publishes none; never estimated or converted between units. scope says which models, plan or condition the numbers apply to.",
          "properties": {
            "requests_per_second": { "type": "integer", "minimum": 1 },
            "requests_per_minute": { "type": "integer", "minimum": 1 },
            "requests_per_day": { "type": "integer", "minimum": 1 },
            "requests_per_month": { "type": "integer", "minimum": 1 },
            "tokens_per_day": { "type": "integer", "minimum": 1 },
            "tokens_per_month": { "type": "integer", "minimum": 1 },
            "scope": { "type": "string", "minLength": 1 },
            "source": { "type": "string", "format": "uri", "description": "The provider's own page that states the numbers." },
            "checked": { "type": "string", "format": "date", "description": "The day the numbers were read on that page." }
          }
        },
        "no_expiry": {
          "type": ["object", "null"],
          "additionalProperties": false,
          "required": ["source", "checked", "quote"],
          "description": "Present only on a one-time trial credit whose provider says in its own words that the credit does not expire. Null (or absent) means the provider says nothing. expires stays null when this is set; it never carries a literal.",
          "properties": {
            "source": { "type": "string", "format": "uri", "description": "The provider's own page that says it." },
            "checked": { "type": "string", "format": "date", "description": "The day the passage was read on that page." },
            "quote": { "type": "string", "minLength": 1, "maxLength": 300, "description": "The passage, as the page words it (a sentence, not a paragraph)." }
          }
        },
        "data_policy": {
          "type": ["object", "null"],
          "additionalProperties": false,
          "required": ["source", "checked"],
          "description": "What the provider itself says about your prompts on this free access: whether it trains on them and how long it keeps them. Absent or null means nobody has recorded it, never that the answer is no. At least one of trains_on_prompts and retention is set; a part the provider does not state stays null.",
          "properties": {
            "trains_on_prompts": { "type": ["boolean", "null"], "description": "true = the provider says it may train on prompts and outputs of this free access (even if you can opt out); false = it says it does not; null = not stated." },
            "retention": { "type": ["string", "null"], "minLength": 1, "maxLength": 120, "description": "How long prompts are kept, as the provider words it (for example \"30 days\" or \"not stored\"); null = not stated." },
            "source": { "type": "string", "format": "uri", "description": "The provider's own page that states it." },
            "checked": { "type": "string", "format": "date", "description": "The day the page was read." }
          }
        },
        "verified": {
          "type": "boolean",
          "description": "true = core facts independently confirmed against the provider's own docs on last_verified. false = sourced from community tracking, flagged for follow-up."
        },
        "last_verified": {
          "type": ["string", "null"],
          "description": "Date of the last independent confirmation (YYYY-MM-DD). Must be null when verified is false."
        },
        "added": {
          "type": "string",
          "description": "Date (YYYY-MM-DD) the provider first entered the dataset. Optional provenance field; drives a client-side \"new\" marker on the explorer. Never changes once set.",
          "format": "date"
        },
        "last_probed": {
          "type": ["string", "null"],
          "description": "Date (YYYY-MM-DD) the provider's API was last called live with a real key by scripts/probe.mjs. Independent of `verified` (which is docs-based)."
        },
        "probe_status": {
          "type": ["string", "null"],
          "enum": ["live", "auth-ok", "auth-failed", "tier-ended", "rate-limited", "error", null],
          "description": "Outcome of the last probe. `live` = a real free-tier inference call succeeded; `auth-ok` = credentials accessed /models but no inference was attempted. `tier-ended` = the key authenticated but the free tier appears gone (e.g. 402)."
        }
      },
      "allOf": [
        {
          "if": { "required": ["model_tier"], "properties": { "model_tier": { "type": "integer" } } },
          "then": { "required": ["model_tier_source"], "properties": { "model_tier_source": { "type": "object" } } }
        },
        {
          "if": { "required": ["model_tier_source"], "properties": { "model_tier_source": { "type": "object" } } },
          "then": { "required": ["model_tier"], "properties": { "model_tier": { "type": "integer" } } }
        },
        {
          "if": { "properties": { "verified": { "const": true } } },
          "then": {
            "required": ["last_verified", "docs_url"],
            "properties": {
              "last_verified": { "type": "string", "format": "date" },
              "docs_url": { "minLength": 1, "format": "uri" }
            }
          }
        }
      ]
    }
  }
}
